{
  "schema_version": "external-item-workbook-mapping/1.0",
  "mapping_id": "extitemmap_ce2c7ae015a74a209c18f5b7352e1d93",
  "mapping_revision_id": "extitemmaprev_1b225d2ea9054b53a12e42a13d4a126f",
  "revision_number": 1,
  "state": "RELEASED",
  "source_namespace": "notion-integrated-science",
  "worksheet_name": "통합과학 DB bf779246bd894420",
  "header_row": 1,
  "first_data_row": 2,
  "maximum_rows": 1297,
  "column_headers": [
    {"column": "A", "label": "No."},
    {"column": "B", "label": "(검토자 1) 난이도"},
    {"column": "C", "label": "(검토자 2) 난이도 "},
    {"column": "D", "label": "(검토자 3) 난이도"},
    {"column": "E", "label": "(검토자 4) 난이도"},
    {"column": "F", "label": "(검토팀장) 반려 사유"},
    {"column": "G", "label": "(원문항) Tutor - INDEX"},
    {"column": "H", "label": "(원문항) 배점"},
    {"column": "I", "label": "(컨텐츠팀장) 출제 의도"},
    {"column": "J", "label": "(평균) 난이도"},
    {"column": "K", "label": ".ai"},
    {"column": "L", "label": "1교"},
    {"column": "M", "label": "2교"},
    {"column": "N", "label": "3교"},
    {"column": "O", "label": "Grade"},
    {"column": "P", "label": "Month"},
    {"column": "Q", "label": "Tag - 대단원"},
    {"column": "R", "label": "Tag - 중단원"},
    {"column": "S", "label": "Year"},
    {"column": "T", "label": "고난도(0/1)"},
    {"column": "U", "label": "고유번호"},
    {"column": "V", "label": "교재 분류"},
    {"column": "W", "label": "기출변형(0/1)"},
    {"column": "X", "label": "반려 여부"},
    {"column": "Y", "label": "분류"},
    {"column": "Z", "label": "분야"},
    {"column": "AA", "label": "자동번호"},
    {"column": "AB", "label": "작업자(병훈지민태욱)"},
    {"column": "AC", "label": "출제일"},
    {"column": "AD", "label": "출제자"},
    {"column": "AE", "label": "탐구 지정"},
    {"column": "AF", "label": "회차"}
  ],
  "external_number_column": "U",
  "edition_columns": {"draft": "L", "second": "M", "third": "N"},
  "rejection_column": "X",
  "normalization_policy": "external-item-notion-link/1.0",
  "released_at": "2026-10-27T06:01:00Z",
  "released_by": "guiadmin",
  "mapping_sha256": "sha256:a13555b5d3ff07e6fbc0c778824e69196587b4ac7e182fea5bec21bae732d849"
}
